{
  "schema_version": 1,
  "plan_id": "pet-care-api-contract",
  "approved_at": "2026-09-06T13:30:00Z",
  "approved_by": "standing grant — Pet Care hardening roadmap (user chat 2026-09-05)",
  "approved_until": "2026-09-08T13:30:00Z",
  "content_hash": "sha256:3f5aeac587e9ffe596b3d2151957e424dfe9399254c4e0ef67b773fbc0522505",
  "autonomy": "completed",
  "default_merge_mode": "auto",
  "base_branch": "main",
  "control_issue": 1021,
  "artifact_branch_policy": "phase-branch",
  "phases": [
    {
      "id": "1",
      "title": "OpenAPI subset + validation + contract tests (F-14)",
      "branch": "cursor/pet-care-api-contract-75cb",
      "allowed_paths": [
        ".agents/plans/pet-care-api-contract.*",
        "docs/architecture/openapi/**",
        "docs/architecture/api-reference.md",
        "scripts/validate_openapi.js",
        "scripts/validate_openapi.test.js",
        "scripts/pre-push-changed.sh",
        "server/lib/openapi/**",
        "server/test/openapi/**",
        "server/test/pets/**",
        "docs/engineering/pet-care-hardening/README.md"
      ],
      "forbidden_paths": [
        ".github/workflows/**",
        "e2e/**",
        "flutter_app/**"
      ],
      "allowed_exceptions": [
        "tests",
        "docs"
      ],
      "spawn_allowed": false,
      "spawn_config": null,
      "merge_mode": "auto",
      "merge_method": "squash",
      "exit_checklist": "governance",
      "status": "merged",
      "status_reason": null,
      "status_detail": null,
      "debt_issue_refs": [],
      "pr_url": "https://github.com/KanopeeKa/AgathaCheck/pull/1022",
      "pr_head_sha": "3c112782"
    }
  ]
}
