{
  "schema_version": 1,
  "plan_id": "ci-speedup",
  "approved_at": "2026-07-23T14:00:00Z",
  "approved_by": "human-go-2026-07-23",
  "approved_until": "2026-07-25T14:00:00Z",
  "content_hash": "sha256:f4331f4bb96c8688b3f0d767a23e296aba6e748d0c593786f53dcd64571a563e",
  "autonomy": "revoked",
  "default_merge_mode": "auto",
  "base_branch": "main",
  "control_issue": 285,
  "artifact_branch_policy": "phase-branch",
  "phases": [
    {
      "id": "1",
      "title": "Runner setup caching",
      "branch": "cursor/ci-speedup-phase1-cache-b697",
      "allowed_paths": [
        ".github/actions/**",
        ".github/workflows/_reusable-e2e-local.yml",
        ".github/workflows/_reusable-flutter-test-shard.yml",
        ".github/workflows/_reusable-flutter-coverage.yml",
        ".agents/plans/**"
      ],
      "forbidden_paths": [
        "db/migrations/**",
        "server/config/security.js",
        "infra/**"
      ],
      "allowed_exceptions": [
        "tests",
        "docs"
      ],
      "spawn_allowed": false,
      "spawn_config": null,
      "merge_method": "squash",
      "exit_checklist": "governance",
      "status": "merged",
      "status_reason": null,
      "status_detail": null,
      "pr_url": "https://github.com/KanopeeKa/AgathaCheck/pull/286",
      "pr_head_sha": "1ff5dd3",
      "debt_issue_refs": []
    },
    {
      "id": "2",
      "title": "Rebalance rest Flutter shard",
      "branch": "cursor/ci-speedup-phase2-shards-b697",
      "allowed_paths": [
        "flutter_app/scripts/run_tests_ci_shard.sh",
        "flutter_app/scripts/merge_flutter_coverage.sh",
        ".github/workflows/ci.yml",
        ".github/workflows/_reusable-ci-gate.yml",
        "scripts/ci/assert-ci-gate.sh",
        "docs/pipelines/ci-cd-gates.md",
        ".agents/plans/**"
      ],
      "forbidden_paths": [
        "db/migrations/**",
        "server/config/security.js",
        "infra/**"
      ],
      "allowed_exceptions": [
        "tests",
        "docs"
      ],
      "spawn_allowed": false,
      "spawn_config": null,
      "merge_method": "squash",
      "exit_checklist": "governance",
      "status": "merged",
      "status_reason": null,
      "status_detail": null,
      "debt_issue_refs": [],
      "pr_url": "https://github.com/KanopeeKa/AgathaCheck/pull/287",
      "pr_head_sha": "e919e5c"
    },
    {
      "id": "3",
      "title": "Path-scoped PR CI",
      "branch": "cursor/ci-speedup-phase3-scope-b697",
      "allowed_paths": [
        "scripts/ci/ci-scope-lib.sh",
        "scripts/ci/resolve-ci-scope.sh",
        "scripts/pre-push-changed.sh",
        ".github/workflows/ci.yml",
        "scripts/ci/assert-ci-gate.sh",
        ".github/workflows/_reusable-ci-gate.yml",
        "docs/pipelines/ci-cd-gates.md",
        "scripts/ci/ci-scope.test.js",
        ".agents/plans/**"
      ],
      "forbidden_paths": [
        "db/migrations/**",
        "server/config/security.js",
        "infra/**"
      ],
      "allowed_exceptions": [
        "tests",
        "docs"
      ],
      "spawn_allowed": false,
      "spawn_config": null,
      "merge_method": "squash",
      "exit_checklist": "governance",
      "status": "merged",
      "status_reason": null,
      "status_detail": null,
      "debt_issue_refs": [],
      "pr_url": "https://github.com/KanopeeKa/AgathaCheck/pull/291"
    },
    {
      "id": "4",
      "title": "Conditional gates + 12-merge full audit",
      "branch": "cursor/ci-speedup-phase4-audit-b697",
      "allowed_paths": [
        ".github/workflows/**",
        "scripts/ci/**",
        "docs/pipelines/ci-cd-gates.md",
        "scripts/pre-push-changed.sh",
        ".agents/plans/**"
      ],
      "forbidden_paths": [
        "db/migrations/**",
        "server/config/security.js",
        "infra/**"
      ],
      "allowed_exceptions": [
        "tests",
        "docs"
      ],
      "spawn_allowed": false,
      "spawn_config": null,
      "merge_method": "squash",
      "exit_checklist": "governance",
      "status": "in_progress",
      "status_reason": null,
      "status_detail": null,
      "debt_issue_refs": [],
      "pr_url": "https://github.com/KanopeeKa/AgathaCheck/pull/292",
      "pr_head_sha": "bbf7692116a51101f724b703ca5604aa9bd19259"
    }
  ]
}
