{
  "schema_version": 1,
  "plan_id": "pet-care-auth-platform",
  "approved_at": "2026-09-06T06:00:00Z",
  "approved_by": "standing grant — Pet Care hardening roadmap (user chat 2026-09-05)",
  "approved_until": "2026-09-08T06:00:00Z",
  "content_hash": "sha256:17613655293e391f5e439b97d16104cd1bb98f9828b373786cfc5572e4f071ee",
  "autonomy": "active",
  "default_merge_mode": "auto",
  "base_branch": "main",
  "control_issue": 1005,
  "artifact_branch_policy": "phase-branch",
  "phases": [
    {
      "id": "1",
      "title": "Central auth middleware + capability policy skeleton (F-08)",
      "branch": "cursor/pet-care-auth-platform-75cb",
      "allowed_paths": [
        ".agents/plans/pet-care-auth-platform.*",
        "server/lib/requireAuth.js",
        "server/lib/petCapabilityPolicy.js",
        "server/routes/sharing.js",
        "server/routes/pets/**",
        "server/routes/healthEntries/**",
        "server/routes/healthIssues/**",
        "server/routes/healthFiles.js",
        "server/routes/weightEntries.js",
        "server/routes/vets.js",
        "server/routes/notifications.js",
        "server/test/requireAuth.test.js",
        "server/test/petCapabilityPolicy.test.js",
        "server/test/**",
        "docs/engineering/pet-care-hardening/README.md",
        "docs/domains/pet_care/changes/hardening-discovery.md"
      ],
      "forbidden_paths": [
        ".github/workflows/**",
        "e2e/**",
        "flutter_app/**"
      ],
      "allowed_exceptions": [
        "tests",
        "docs"
      ],
      "spawn_allowed": false,
      "spawn_config": null,
      "merge_mode": "auto",
      "merge_method": "squash",
      "exit_checklist": "single-backend-route",
      "status": "in_progress",
      "status_reason": null,
      "status_detail": null,
      "debt_issue_refs": [],
      "pr_url": "https://github.com/KanopeeKa/AgathaCheck/pull/1006",
      "pr_head_sha": "6a47948e"
    }
  ]
}
