{
  "schema_version": 1,
  "plan_id": "pet-care-security-hardening",
  "approved_at": "2026-09-06T17:40:00Z",
  "approved_by": "standing grant — Pet Care hardening roadmap (user chat 2026-09-05)",
  "approved_until": "2026-09-08T17:40:00Z",
  "autonomy": "completed",
  "default_merge_mode": "auto",
  "base_branch": "main",
  "control_issue": 1032,
  "artifact_branch_policy": "phase-branch",
  "phases": [
    {
      "id": "1",
      "title": "Helmet headers + static upload rate limit (F-15, F-16)",
      "branch": "cursor/pet-care-security-hardening-75cb",
      "allowed_paths": [
        ".agents/plans/pet-care-security-hardening.*",
        "server/config/securityHeaders.js",
        "server/config/rateLimit.js",
        "server/bin/server.js",
        "server/package.json",
        "server/package-lock.json",
        "server/test/securityHeaders.test.js",
        "docs/engineering/pet-care-hardening/README.md"
      ],
      "forbidden_paths": [
        ".github/workflows/**",
        "e2e/**",
        "flutter_app/**"
      ],
      "allowed_exceptions": [
        "tests"
      ],
      "spawn_allowed": false,
      "spawn_config": null,
      "merge_mode": "auto",
      "merge_method": "squash",
      "exit_checklist": "governance",
      "status": "merged",
      "status_reason": null,
      "status_detail": null,
      "debt_issue_refs": [],
      "pr_url": "https://github.com/KanopeeKa/AgathaCheck/pull/1031",
      "pr_head_sha": "f65d2226",
      "merge_commit": "fc4c27f48de91979686fc4c0608be22bba7d8249"
    }
  ],
  "content_hash": "sha256:93c63c2839137f88dbecca6c7a27b48a382e36b733c0558cac689f0593f5b923"
}
