{
  "schema_version": 1,
  "plan_id": "notifications-v2-foundation-7f3b",
  "approved_at": "2026-10-04T23:00:00Z",
  "approved_by": "GitHub #1571 approve-autonomous + user chat 2026-10-04 standing grant (notifications v2 roadmap)",
  "approved_until": "2026-10-06T23:00:00Z",
  "autonomy": "active",
  "default_merge_mode": "auto",
  "base_branch": "cursor/notifications-v2-foundation-integration-7f3b",
  "control_issue": 1571,
  "artifact_branch_policy": "phase-branch",
  "phases": [
    {
      "id": "1",
      "title": "Spec rev 2.3.1 documentation fixes",
      "branch": "cursor/notifications-v2-spec-231-7f3b",
      "allowed_paths": [
        "docs/domains/notifications/**",
        "docs/domains/cross-domain/changes/program-contract.md",
        "docs/domains/people/features/people-care-team.md",
        "docs/domains/subscription/**",
        "docs/debt/debt.md",
        ".agents/plans/notifications-v2-foundation-7f3b.*",
        ".agents/plans/notifications-v2-roadmap-7f3b.*"
      ],
      "forbidden_paths": [
        "flutter_app/**",
        "server/**",
        "db/migrations/**",
        ".github/workflows/**"
      ],
      "allowed_exceptions": [
        "docs"
      ],
      "spawn_allowed": false,
      "spawn_config": null,
      "merge_mode": "auto",
      "merge_method": "squash",
      "exit_checklist": "governance",
      "status": "in_progress",
      "status_reason": null,
      "status_detail": null,
      "debt_issue_refs": []
    },
    {
      "id": "2",
      "title": "Merge accepted spec and docs to main",
      "branch": "cursor/notifications-v2-spec-231-7f3b",
      "allowed_paths": [
        "docs/domains/notifications/**",
        "docs/domains/cross-domain/changes/program-contract.md",
        "docs/domains/people/features/people-care-team.md",
        "docs/domains/subscription/**",
        "docs/debt/debt.md",
        ".agents/plans/notifications-v2-foundation-7f3b.*"
      ],
      "forbidden_paths": [
        "flutter_app/**",
        "server/**",
        "db/migrations/**",
        ".github/workflows/**"
      ],
      "allowed_exceptions": [
        "docs"
      ],
      "spawn_allowed": false,
      "spawn_config": null,
      "merge_mode": "auto",
      "merge_method": "squash",
      "exit_checklist": "governance",
      "status": "pending",
      "status_reason": null,
      "status_detail": null,
      "pr_url": null,
      "merge_commit": null,
      "debt_issue_refs": []
    }
  ],
  "content_hash": "sha256:7e660bd3ae967e8339ee239849f2551b4bfd30a71c7963261a4d8e0b5febbbc0"
}
