{
  "schema_version": 1,
  "plan_id": "notifications-v2-2-remediation-main-7f3b",
  "approved_at": "2026-10-07T11:30:00Z",
  "approved_by": "User chat 2026-10-07: standing grant remediation A–E / execute-plan",
  "approved_until": "2026-10-09T11:30:00Z",
  "autonomy": "completed",
  "default_merge_mode": "auto",
  "base_branch": "main",
  "control_issue": 1764,
  "artifact_branch_policy": "phase-branch",
  "phases": [
    {
      "id": "1",
      "title": "Integration batch to main",
      "branch": "cursor/notifications-v2-2-remediation-integration-7f3b",
      "allowed_paths": [
        "**"
      ],
      "forbidden_paths": [
        ".github/workflows/**"
      ],
      "allowed_exceptions": [
        "docs",
        "tests"
      ],
      "spawn_allowed": false,
      "merge_mode": "auto",
      "merge_method": "squash",
      "exit_checklist": "default",
      "status": "merged",
      "status_reason": null,
      "status_detail": null,
      "pr_url": "https://github.com/KanopeeKa/AgathaCheck/pull/1767",
      "pr_head_sha": "b4bac93a"
    }
  ],
  "content_hash": "sha256:b83eba0147599a531d4382857351d0120db4440ce7f89630d9f9b5771f927e5d"
}
