{
  "schema_version": 1,
  "plan_id": "uat-coordinator-launch-fix-7808",
  "approved_at": "2026-07-25T11:45:00Z",
  "approved_by": "user-request",
  "approved_until": "2026-07-27T11:45:00Z",
  "content_hash": "sha256:d59bfd4e0793daa070b1c1e1ef9120dbba2b1fb686c5a53f31fc83858cdaa0ef",
  "autonomy": "revoked",
  "default_merge_mode": "auto",
  "base_branch": "main",
  "control_issue": 345,
  "artifact_branch_policy": "phase-branch",
  "phases": [
    {
      "id": "1",
      "title": "Guard launch-cursor-agent main()",
      "branch": "cursor/uat-coordinator-launch-guard-7808",
      "allowed_paths": [
        ".github/scripts/launch-cursor-agent.js",
        ".github/scripts/launch-uat-coordinator.test.js"
      ],
      "forbidden_paths": [
        "flutter_app/**",
        "server/**"
      ],
      "allowed_exceptions": [
        "tests"
      ],
      "spawn_allowed": false,
      "spawn_config": null,
      "merge_mode": "auto",
      "merge_method": "squash",
      "exit_checklist": "default",
      "status": "in_progress",
      "status_reason": null,
      "status_detail": null,
      "debt_issue_refs": [],
      "pr_url": "https://github.com/KanopeeKa/AgathaCheck/pull/346",
      "pr_head_sha": "016e469a9667ddae8685e6516a68ba90015c2b9f"
    }
  ]
}
