{
  "schema_version": 1,
  "approved_at": "2026-10-04T17:40:08.000Z",
  "approved_until": "2026-10-06T17:40:08.000Z",
  "content_hash": "sha256:31079cba4fce28cd0d907cc6d86f157616ff850a63486cecba653fde76c75aae",
  "autonomy": "completed",
  "default_merge_mode": "auto",
  "control_issue": 1460,
  "artifact_branch_policy": "phase-branch",
  "plan_id": "people-domain-refactor-7f3b",
  "plan_kind": "roadmap",
  "programme_ref": "docs/domains/people/changes/people-domain-refactor.md",
  "base_branch": "main",
  "approved_by": "user chat 2026-10-04: resume after CARE A+B (#1448) + ARCH E (#1503); renews #1460 grant",
  "current_child_plan_id": null,
  "phases": [
    {
      "id": "orchestrate",
      "title": "Roadmap orchestration (child bootstrap, gates, broadcasts)",
      "branch": "cursor/people-refactor-orchestrate-7f3b",
      "allowed_paths": [
        ".agents/plans/people-domain-refactor-7f3b.md",
        ".agents/plans/people-domain-refactor-7f3b.snapshot.json",
        ".agents/plans/people-hotfixes-7f3b.md",
        ".agents/plans/people-hotfixes-7f3b.snapshot.json",
        ".agents/plans/people-server-7f3b.md",
        ".agents/plans/people-server-7f3b.snapshot.json",
        ".agents/plans/people-client-core-7f3b.md",
        ".agents/plans/people-client-core-7f3b.snapshot.json",
        ".agents/plans/people-client-integration-7f3b.md",
        ".agents/plans/people-client-integration-7f3b.snapshot.json",
        "docs/domains/people/**",
        "docs/agent-efficiency/parallel-programmes.md"
      ],
      "forbidden_paths": [
        ".github/workflows/**",
        "server/**",
        "flutter_app/**",
        "e2e/**",
        "db/**"
      ],
      "allowed_exceptions": [
        "docs"
      ],
      "spawn_allowed": false,
      "spawn_config": null,
      "merge_method": "squash",
      "exit_checklist": "governance",
      "status": "merged",
      "status_reason": null,
      "status_detail": null,
      "debt_issue_refs": []
    }
  ],
  "child_plans": [
    {
      "plan_id": "people-hotfixes-7f3b",
      "status": "merged",
      "pr_url": "https://github.com/KanopeeKa/AgathaCheck/pull/1464",
      "merge_commit": "3ca7bd4ccb2063fff271bb68fba7a7681a4d7788"
    },
    {
      "plan_id": "people-server-7f3b",
      "status": "merged",
      "pr_url": "https://github.com/KanopeeKa/AgathaCheck/pull/1523",
      "merge_commit": "4f3325d42bec9e56abd42f8d9d6b500f17e44314"
    },
    {
      "plan_id": "people-client-core-7f3b",
      "status": "merged",
      "pr_url": "https://github.com/KanopeeKa/AgathaCheck/pull/1625",
      "merge_commit": "6a42aefb79754a3f0597f91d8f99fde22903ad76"
    },
    {
      "plan_id": "people-client-integration-7f3b",
      "status": "merged",
      "pr_url": "https://github.com/KanopeeKa/AgathaCheck/pull/1677",
      "merge_commit": "3657982b8860a392598db0b6621f1794901910ec"
    }
  ]
}
